{
  "$schema": "../../../schemas/roadmap.schema.json",
  "schemaVersion": 1,
  "source": "College Board AP Precalculus Course and Exam Description · Effective Fall 2026",
  "sourceUrl": "https://apcentral.collegeboard.org/media/pdf/ap-precalculus-course-and-exam-description.pdf",
  "units": [
    {
      "id": 1,
      "title": "Polynomial and Rational Functions",
      "shortTitle": "Polynomial + rational",
      "course": "Exam content",
      "weight": "30–40%",
      "color": "#20c997",
      "reference": "https://openstax.org/books/precalculus-2e/pages/3-introduction-to-polynomial-and-rational-functions",
      "video": "https://www.youtube.com/results?search_query=The+Organic+Chemistry+Tutor+polynomial+rational+functions+precalculus",
      "topics": [
        {"id":"1.1","title":"Change in Tandem"},
        {"id":"1.2","title":"Rates of Change"},
        {"id":"1.3","title":"Rates of Change in Linear and Quadratic Functions"},
        {"id":"1.4","title":"Polynomial Functions and Rates of Change"},
        {"id":"1.5","title":"Polynomial Functions and Complex Zeros"},
        {"id":"1.6","title":"Polynomial Functions and End Behavior"},
        {"id":"1.7","title":"Rational Functions and End Behavior"},
        {"id":"1.8","title":"Rational Functions and Zeros"},
        {"id":"1.9","title":"Rational Functions and Vertical Asymptotes"},
        {"id":"1.10","title":"Rational Functions and Holes"},
        {"id":"1.11","title":"Equivalent Representations of Polynomial and Rational Expressions"},
        {"id":"1.12","title":"Transformations of Functions"},
        {"id":"1.13","title":"Function Model Selection and Assumption Articulation"},
        {"id":"1.14","title":"Function Model Construction and Application"}
      ]
    },
    {
      "id": 2,
      "title": "Exponential and Logarithmic Functions",
      "shortTitle": "Exponential + logarithmic",
      "course": "Exam content",
      "weight": "25–40%",
      "color": "#5d3fd3",
      "reference": "https://openstax.org/books/precalculus-2e/pages/4-introduction-to-exponential-and-logarithmic-functions",
      "video": "https://www.youtube.com/results?search_query=The+Organic+Chemistry+Tutor+exponential+logarithmic+functions+precalculus",
      "topics": [
        {"id":"2.1","title":"Change in Arithmetic and Geometric Sequences"},
        {"id":"2.2","title":"Change in Linear and Exponential Functions"},
        {"id":"2.3","title":"Exponential Functions"},
        {"id":"2.4","title":"Exponential Function Manipulation"},
        {"id":"2.5","title":"Exponential Function Context and Data Modeling"},
        {"id":"2.6","title":"Competing Function Model Validation"},
        {"id":"2.7","title":"Composition of Functions"},
        {"id":"2.8","title":"Inverse Functions"},
        {"id":"2.9","title":"Logarithmic Expressions"},
        {"id":"2.10","title":"Inverses of Exponential Functions"},
        {"id":"2.11","title":"Logarithmic Functions"},
        {"id":"2.12","title":"Logarithmic Function Manipulation"},
        {"id":"2.13","title":"Exponential and Logarithmic Equations and Inequalities"},
        {"id":"2.14","title":"Logarithmic Function Context and Data Modeling"},
        {"id":"2.15","title":"Semi-log Plots"}
      ]
    },
    {
      "id": 3,
      "title": "Trigonometric and Polar Functions",
      "shortTitle": "Trigonometric + polar",
      "course": "Exam content",
      "weight": "30–35%",
      "color": "#2478d4",
      "reference": "https://openstax.org/books/precalculus-2e/pages/5-introduction-to-trigonometric-functions",
      "video": "https://www.youtube.com/results?search_query=The+Organic+Chemistry+Tutor+trigonometry+polar+coordinates+precalculus",
      "topics": [
        {"id":"3.1","title":"Periodic Phenomena"},
        {"id":"3.2","title":"Sine, Cosine, and Tangent"},
        {"id":"3.3","title":"Sine and Cosine Function Values"},
        {"id":"3.4","title":"Sine and Cosine Function Graphs"},
        {"id":"3.5","title":"Sinusoidal Functions"},
        {"id":"3.6","title":"Sinusoidal Function Transformations"},
        {"id":"3.7","title":"Sinusoidal Function Context and Data Modeling"},
        {"id":"3.8","title":"The Tangent Function"},
        {"id":"3.9","title":"Inverse Trigonometric Functions"},
        {"id":"3.10","title":"Trigonometric Equations and Inequalities"},
        {"id":"3.11","title":"The Secant, Cosecant, and Cotangent Functions"},
        {"id":"3.12","title":"Equivalent Representations of Trigonometric Functions"},
        {"id":"3.13","title":"Trigonometry and Polar Coordinates"},
        {"id":"3.14","title":"Polar Function Graphs"},
        {"id":"3.15","title":"Rates of Change in Polar Functions"}
      ]
    },
    {
      "id": 4,
      "title": "Functions Involving Parameters, Vectors, and Matrices",
      "shortTitle": "Parameters + vectors + matrices",
      "course": "Optional · not assessed",
      "weight": "Not assessed on AP Exam",
      "color": "#d6622a",
      "reference": "https://openstax.org/books/precalculus-2e/pages/8-introduction-to-further-applications-of-trigonometry",
      "video": "https://www.youtube.com/results?search_query=The+Organic+Chemistry+Tutor+parametric+equations+vectors+matrices+precalculus",
      "topics": [
        {"id":"4.1","title":"Parametric Functions"},
        {"id":"4.2","title":"Parametric Functions Modeling Planar Motion"},
        {"id":"4.3","title":"Parametric Functions and Rates of Change"},
        {"id":"4.4","title":"Parametrically Defined Circles and Lines"},
        {"id":"4.5","title":"Implicitly Defined Functions"},
        {"id":"4.6","title":"Conic Sections"},
        {"id":"4.7","title":"Parametrization of Implicitly Defined Functions"},
        {"id":"4.8","title":"Vectors"},
        {"id":"4.9","title":"Vector-Valued Functions"},
        {"id":"4.10","title":"Matrices"},
        {"id":"4.11","title":"The Inverse and Determinant of a Matrix"},
        {"id":"4.12","title":"Linear Transformations and Matrices"},
        {"id":"4.13","title":"Matrices as Functions"},
        {"id":"4.14","title":"Matrices Modeling Contexts"}
      ]
    }
  ]
}
